{
  "generated_at": "2026-01-22T08:24:02.589199",
  "generated_at_human": "January 22, 2026 at 08:24 AM",
  "forecast_days": 7,
  "forecasts": [
    {
      "date": "2026-01-23",
      "day_of_week": "Friday",
      "day_number": 1,
      "probability": 10,
      "event_type": "QUIET",
      "confidence": "LOW",
      "lead_time": "N/A",
      "ensemble_score": 0.0,
      "regional_score": 0.0,
      "global_score": 0.0,
      "forecast_category": "none",
      "active_signals": 0,
      "expected_snowfall": "0-5mm (trace or none)",
      "icon": "\u26aa",
      "alert_level": "MINIMAL"
    },
    {
      "date": "2026-01-24",
      "day_of_week": "Saturday",
      "day_number": 2,
      "probability": 10,
      "event_type": "QUIET",
      "confidence": "LOW",
      "lead_time": "N/A",
      "ensemble_score": 0.0,
      "regional_score": 0.0,
      "global_score": 0.0,
      "forecast_category": "none",
      "active_signals": 0,
      "expected_snowfall": "0-5mm (trace or none)",
      "icon": "\u26aa",
      "alert_level": "MINIMAL"
    },
    {
      "date": "2026-01-25",
      "day_of_week": "Sunday",
      "day_number": 3,
      "probability": 10,
      "event_type": "QUIET",
      "confidence": "LOW",
      "lead_time": "N/A",
      "ensemble_score": 0.0,
      "regional_score": 0.0,
      "global_score": 0.0,
      "forecast_category": "none",
      "active_signals": 0,
      "expected_snowfall": "0-5mm (trace or none)",
      "icon": "\u26aa",
      "alert_level": "MINIMAL"
    },
    {
      "date": "2026-01-26",
      "day_of_week": "Monday",
      "day_number": 4,
      "probability": 10,
      "event_type": "QUIET",
      "confidence": "LOW",
      "lead_time": "N/A",
      "ensemble_score": 0.0,
      "regional_score": 0.0,
      "global_score": 0.0,
      "forecast_category": "none",
      "active_signals": 0,
      "expected_snowfall": "0-5mm (trace or none)",
      "icon": "\u26aa",
      "alert_level": "MINIMAL"
    },
    {
      "date": "2026-01-27",
      "day_of_week": "Tuesday",
      "day_number": 5,
      "probability": 10,
      "event_type": "QUIET",
      "confidence": "LOW",
      "lead_time": "N/A",
      "ensemble_score": 0.0,
      "regional_score": 0.0,
      "global_score": 0.0,
      "forecast_category": "none",
      "active_signals": 0,
      "expected_snowfall": "0-5mm (trace or none)",
      "icon": "\u26aa",
      "alert_level": "MINIMAL"
    },
    {
      "date": "2026-01-28",
      "day_of_week": "Wednesday",
      "day_number": 6,
      "probability": 10,
      "event_type": "QUIET",
      "confidence": "LOW",
      "lead_time": "N/A",
      "ensemble_score": 0.0,
      "regional_score": 0.0,
      "global_score": 0.0,
      "forecast_category": "none",
      "active_signals": 0,
      "expected_snowfall": "0-5mm (trace or none)",
      "icon": "\u26aa",
      "alert_level": "MINIMAL"
    },
    {
      "date": "2026-01-29",
      "day_of_week": "Thursday",
      "day_number": 7,
      "probability": 10,
      "event_type": "QUIET",
      "confidence": "LOW",
      "lead_time": "N/A",
      "ensemble_score": 0.0,
      "regional_score": 0.0,
      "global_score": 0.0,
      "forecast_category": "none",
      "active_signals": 0,
      "expected_snowfall": "0-5mm (trace or none)",
      "icon": "\u26aa",
      "alert_level": "MINIMAL"
    }
  ],
  "recent_observations": [],
  "summary_text": "\n7-DAY FORECAST SUMMARY for Northern Wisconsin\nGenerated: January 22, 2026 at 08:24 AM\n\nOVERVIEW:\n  \u2022 0 day(s) with snow potential (\u226530% probability)\n  \u2022 Highest probability: 10% on Friday, 2026-01-23\n  \u2022 Primary patterns: Quiet conditions\n\nDETAILED OUTLOOK:\n\nFriday, 2026-01-23:\n  \u26aa 10% probability - QUIET\n  Expected: 0-5mm (trace or none)\n  Confidence: LOW\n\nSaturday, 2026-01-24:\n  \u26aa 10% probability - QUIET\n  Expected: 0-5mm (trace or none)\n  Confidence: LOW\n\nSunday, 2026-01-25:\n  \u26aa 10% probability - QUIET\n  Expected: 0-5mm (trace or none)\n  Confidence: LOW\n\nMonday, 2026-01-26:\n  \u26aa 10% probability - QUIET\n  Expected: 0-5mm (trace or none)\n  Confidence: LOW\n\nTuesday, 2026-01-27:\n  \u26aa 10% probability - QUIET\n  Expected: 0-5mm (trace or none)\n  Confidence: LOW\n\nWednesday, 2026-01-28:\n  \u26aa 10% probability - QUIET\n  Expected: 0-5mm (trace or none)\n  Confidence: LOW\n\nThursday, 2026-01-29:\n  \u26aa 10% probability - QUIET\n  Expected: 0-5mm (trace or none)\n  Confidence: LOW\n\nALERT LEVELS:\n  \u2744\ufe0f  HIGH (\u226570%) - Major snow likely\n  \ud83c\udf28\ufe0f  MODERATE (50-69%) - Significant snow possible\n  \u2601\ufe0f  LOW (30-49%) - Light snow possible\n  \u26aa MINIMAL (<30%) - Little to no snow expected\n\nLead times:\n  \u2022 Short-range (12-48h): Alberta Clippers, Lake Effect\n  \u2022 Long-range (5-7d): Global atmospheric patterns\n",
  "locations": {
    "phelps_wi": {
      "name": "Phelps, WI",
      "ski_resorts": [
        "Big Snow Resort (nearby)"
      ],
      "display_name": "Northern Wisconsin - Phelps"
    },
    "land_o_lakes_wi": {
      "name": "Land O'Lakes, WI",
      "ski_resorts": [
        "Gateway area"
      ],
      "display_name": "Northern Wisconsin - Land O'Lakes"
    },
    "eagle_river_wi": {
      "name": "Eagle River, WI",
      "ski_resorts": [
        "Numerous area resorts"
      ],
      "display_name": "Northern Wisconsin - Eagle River"
    }
  }
}